Artist,Album,Song Name,Lyrics,
Drake,Scorpion,Summer Games ,"[Chorus]
I think you're changing your mind
Starting to see it in your eyes
I used to love a good surprise
And now, I'd rather know ahead of time
You said ""I love you"" too fast
So much for that, girl, summer just started
And we're already done

[Verse 1]
Yeah, you say I led you on, but you followed me
I follow one of your friends, you unfollow me
Then you block them so they can't see
You liking someone just like me
I expected more from you honestly
Said you want a simple life and that's not me
How you go from that to endin' up with someone just like…?

[Chorus]
How can you be angry on a night in July
And be warm with me when it's freezing outside
You're confusin' me
Don't have me wastin' my time
Yeah, you said ""I love you"" too fast
So much for that, girl
Summer just started, and we're already done

[Verse 2]
I kept it decent
I kept you sane, I kept it peaceful, don't lie
I kept it decent
Even the secrets, kept it between you and I

[Bridge]
Breakin' my heart, tearin' me apart
Breakin' me down when I'm already down
Breakin' my heart– breakin' my heart– breakin' my heart
Breakin' my heart– breakin' my heart–
Brea– brea– brea– brea– brea– brea– brea– brea
Breakin' my heart, tearin' me apart
Breakin' me down when I'm already down
Breakin' my heart– breakin' my heart– breakin' my heart
Breakin' my heart– breakin' my heart–
Brea– brea– brea– brea– brea– brea– brea– brea– brea

[Chorus]
You said ""I love you"" too fast
So much for that, girl
Summer just started, and we're already done
How can you be angry on a night in July
And be warm with me when it's freezing outside
You're confusin' me, don't have me wastin' my time
Yeah, you said ""I love you"" too fast
So much for that, girl
Summer just started, and we're already done",
Drake,Scorpion,Jaded ,"[Intro: Drake]
Ayy, yeah
Dogs on this side, dogs over on this side
Yeah

[Verse 1: Drake & Ty Dolla $ign]
Leaving me (leavin' me)
Dippin' out on me (on me)
Already got what you needed, I guess
Quickly (Quickly) learned yourself through me (Through me)
Already gave you what you needed, I guess (Ooh yeah)
I guess (Yeah) yeah
That's why I'm not with nobody (Ooh yeah)
Cause I don't wanna hurt nobody (Ooh yeah)
Did it over text, didn't call me (Ooh yeah)
Still got love for you, mami
I know you wanna be somebody
Even if you gotta leave somebody (Body) yeah

[Chorus: Drake & Ty Dolla $ign]
Yes I'm hurting, yes I'm jaded (Jaded)
Most of these things I don't wanna say (Jaded)
I wanna be around while you chasin' (While you chasin' it)
You wanna hit me up when you make it
You'll try and come back when you famous
I always want the truth but it's dangerous (Dangerous, oh)
You got somethin' real, not basic (Ooh yeah)
You wanna get with me, stop
Yes I'm hurting, yes I'm jaded (Jaded)
Most of these things, I don't wanna say (Say)
I wanna be around while you chasin'
(Wanna be around, wanna be around)
You wanna hit me up when you make it (Ooh, yeah)
You'll try and come back when you famous
(Back around, back around)
I always want the truth but it's dangerous (Dangerous)
You got somethin' real, not basic
You wanna get with me, stop (Flakin')
Yeah, dogs on this side, dogs over on this side
(Ooh yeah, ooh yeah, ooh yeah)

[Verse 2: Drake & Ty Dolla $ign]
Ayy, told me about all your insecurities, for what?
Dragged me like two hours to your family's house, for what?
Said you need some time but I should stick around, for what?
Always felt like stickin' 'round's the same as being stuck
And like guns with the ink in, you're gettin' under my skin
Pretty little young thing (Young thing)
Had a nigga convinced, got me too excited
Yeah, you played me, you played me, you played me
Lowdown, dirty, shameful, crazy
I need to know how the new nigga you got does the same thing
I do for a living but is way less wavy
How you even managin' to keep straight faces
In all the pictures that I seen lately
Lord knows you still look amazin'
That's besides the point I'm makin'
You're way too opinionated to have to force it, to have to fake it
You had potential, I coulda shaped it
You went and caved in (Ooh yeah)
We coulda waited, I wasn't rushin', difference in ages
You're old enough, but you're still a baby
You've shared stories where you did amazin'
Things to be loyal, things to be patient
That was before me, I musta changed it
Shifted your focus, lens lookin' jaded (Jaded)

[Chorus: Drake & Ty Dolla $ign]
Most of these things I don't wanna say
I wanna be around while you chasin' (While you chasin' it)
You wanna hit me up when you make it
You'll try and come back when you famous
(Back around, back around, dangerous, oh, ooh yeah)
Dogs on this side, dogs over on this side
You wanna get with me, stop (Flakin')",
Drake,Scorpion,Nice For What ,"[Intro: Big Freedia]
I wanna know who mothafuckin' representin' in here tonight
Hold on, hold on

[Pre-Chorus: Lauryn Hill]
I keep lettin' you back in (You back in)
How can I explain myself?

[Chorus: Lauryn Hill & Drake]
Care for me, care for me, you said you'd care for me
There for me, there for me, said you'd be there for me
(Lil Weezyana shit)
Cry for me, cry for me, you said you'd die for me
(Murda on the beat)
Give to me, give to me, why won't you live for me?
Care for me, care for me, I know you care for me
(A song for y'all to cut up to, you know?)
There for me, there for me, said you'd be there for me (Yeah)
Cry for me, cry for me, you said you'd die for me
Give to me, give to me, why won't you live for me?

[Verse 1: Drake]
Everybody get your mothafuckin' roll on
I know shorty and she doesn't want no slow song
Had a man last year, life goes on
Haven't let that thing loose, girl, in so long
You've been inside, know you like to lay low
I've been peepin' what you bringin' to the table
Workin' hard, girl, everything paid for
First-last, phone bill, car note, cable
With your phone out, gotta hit them angles
With your phone out, snappin' like you Fabo
And you showin' off, but it's alright
And you showin' off, but it's alright (Alright!)
It's a short life, yeah

[Chorus: Lauryn Hill]
Care for me, care for me, you said you'd care for me
There for me, there for me, said you'd be there for me
Cry for me, cry for me, you said you'd die for me
Give to me, give to me, why won't you live for me?

[Refrain: Drake]
That's a real one in your reflection
Without a follow, without a mention
You really pipin' up on these niggas
You gotta be nice for what to these niggas?

[Verse 2: Drake]
I understand, you got a hunnid bands
You got a baby Benz, you got some bad friends
High school pics, you was even bad then
You ain't stressin' off no lover in the past tense
You already had them
Work at 8 A.M., finish 'round five
Hoes talk down, you don't see 'em outside
Yeah, they don't really be the same offline
You know dark days, you know hard times
Doin' overtime for the last month
Saturday, call the girls, get 'em gassed up
Gotta hit the club, gotta make that ass jump
Gotta hit the club like you hit them mothafuckin' angles
With your phone out, snappin' like you Fabo
And you showin' off, but it's alright
And you showin' off, but it's alright (Alright!)
It's a short life

[Bridge: Big Freedia & Letitia Wright]
Uh-huh! (Oh yeah!)
These hoes! (They mad!)
Your boy! (I had!)
I made! (Watch the breakdown)

[Chorus: Lauryn Hill]
Care for me, care for me, you said you'd care for me
There for me, there for me, said you'd be there for me
Cry for me, cry for me, you said you'd die for me
Give to me, give to me, why won't you live for me?

[Breakdown: Drake]
Gotta make that jump, gotta make that, gotta, gotta make that
Gotta make that jump, gotta make that, gotta, gotta make that
Gotta, gotta, gotta g-g-gotta, g-g-gotta, gotta
Gotta, g-g-gotta, gotta, gotta make that jump, jump (Let's go)
Bend it over, lift it up, bend it over, lift it up
Make that jump, jump
Bend it over, lift it up, bend it over, lift it up
Make that jump, jump
Bend it over, over, over, over, over, lift it up
Make that jump, jump
Bend it over, lift it up (Make that jump, jump)
Bend it over, lift it up (Make that jump, jump)

[Refrain: Drake]
That's a real one in your reflection
Without a follow, without a mention
You really pipin' up on these niggas
You gotta be nice for what to these niggas?
I understand

[Chorus: Lauryn Hill]
Care for me, care for me, you said you'd care for me
There for me, there for me, said you'd be there for me
Give to me, give to me, why won't you live for me?
Cry for me, cry for me, you said you'd cry for me

[Outro: Drake & Lauryn Hill]
Gotta hit the club like you hit them, hit them, hit them angles
It's a short life, yeah
Cry for me, cry for me, you said you'd die for me
Give to me, give to me, why won't you live for me?",
Drake,Scorpion,Finesse ,"[Intro]
Yeah, turn everything up
Yeah, oh yeah
Turn everything up a little more

[Verse 1]
I want my baby to have your eyes
I'm going against my own advice
Should I do New York? I can't decide
Fashion week is more your thing than mine
I can't even lie, I'd rather stay inside
I can't do suit and tie
Can't be in a room with you and stand on different sides
One thing at a time
I have to learn to hide
One thing at a time
Emotions running high
I wish you felt alright

[Pre-Chorus]
Just hitting my line
All the time, all the time, all the–
You stay on my mind
All the time, all the time (Yeah)

[Chorus]
It takes some finesse
I seen you finesse
He can't know finesse
You stay on my mind

[Verse 2]
You and your sister
Too hot to handle
Things would get cancelled
I would make time for you
Commitment
Going the distance
I'm new to all of this

[Chorus]
It takes some finesse
I seen you finesse
He can't know finesse
You stay on my mind",
Drake,Scorpion,Ratchet Happy Birthday ,"[Chorus: Drake & PARTYNEXTDOOR]
It's your fuckin' birthday (Oh, birthday, I need more liquor)
It's a fuckin' celebration (Oh oh)
Tonight we celebrate
Seems like time's out of our control
It's a celebration, oh oh

[Verse 1: Drake]
It's your birthday, baby, it's your birthday
Yeah, who's gonna love you on your worst day?
You talk so tough
I know you're soft like buttercups
Reese's, Reese's, don't be ridiculous
Just say your piece and peace up like Ibiza
Cool your headtop, you hotter than Anitta
Bakin', baby, tell me where I need to–

[Pre-Chorus: Drake]
To be, to feel, and fill that emptiness inside you
Petty bullshit shouldn't excite you
On your birthday

[Chorus: Drake & PARTYNEXTDOOR]
It's your brrrrrrr–
It's your fuckin' birthday (Oh, birthday, I need more liquor)
It's a fuckin' celebration (Oh oh)
Tonight we celebrate
Seems like time's out of our control (Oh oh)
It's a celebration, oh oh

[Verse 2: Drake]
They tried it, they went for it
All year and you're still here, just ignore it
If it ain't the real thing, you don't want it
GG, CC's all on ya
It's your month and you know it (And you know it)
And you know it's real, don't gotta say it for you
And you know somebody home prayin' for you
You say, ""Play this shit,"" they better play it (Ayy, play it)
For you (For you), on time
And I miss the days that you was all mine
Haven't been official in a long time
So tell me where I need to–

[Pre-Chorus: Drake]
To be, to feel, and fill that emptiness inside you
Petty bullshit shouldn't excite you
On your birthday

[Chorus: Drake & PARTYNEXTDOOR]
It's your brrrrrrr–
It's your fuckin' birthday (Oh, birthday, I need more liquor)
It's a fuckin' celebration (Oh oh)
Tonight we celebrate
Seems like time's out of our control
It's a celebration, oh oh

[Outro: PARTYNEXTDOOR]
Oh, it's your fuckin' birthday, oh, oh",
Drake,Scorpion,That's How You Feel ,"[Intro: Drake]
Yeah, woo

[Verse 1: Drake]
I'm just in the cut sittin' sideways
Way that you lookin' all the time
Time gets to tickin' and it takes a toll
Told you I couldn't really draw the line
Line ringin', sayin' that you told him things
Things that you could've kept inside
Sidetrackin' me when I was good to you
You were somebody I would stand behind

[Chorus: Drake]
I know you like to drink 'til the sun up
Grind 'til you come up
Work all winter, shine all summer
Ride for your brother
You die for your mother
Keep that shit a hunna
I know you wanna
Vacay to a place where you could
Take pictures, post on Insta
Your friends say they miss ya
But they don't really miss ya

[Refrain: Nicki Minaj & (DJ Boof)]
Rule number one, to be a boss-ass bitch (Uh-huh)
Never let a clown nigga try to play you (Okay)
If he play you, then rule number two (Okay)
Is fuck his best friends and make 'em yes men (Okay)
And– (Wow, that's how you feel?)

[Verse 2: Drake]
I'm just in the cut sittin' sideways
Way that you lookin' all the time
Time, it done left you with a broken heart
Hardly excuses how you play with mine
Mindin' my business and you show up
Up to no good, I should've seen the signs
Signin' me up to do your dirty work
Workin' to try and get you off my mind

[Chorus: Drake]
I know you like to drink 'til the sun up
Grind 'til you come up
Work all winter, shine all summer
Ride for your brother
You die for your mother
Keep that shit a hunna
I know you wanna
Vacay to a place where you could
Take pictures, post on Insta
Your friends say they miss ya
But they don't really miss ya

[Outro: Nicki Minaj & (DJ Boof)]
What the fuck, this ain't Chanel, nigga?! Custom down?!
What the fuck, I ain't smokin' hot?! Bust me down?!
You the same clown nigga that was runnin' me down?!
Now you all up in my…'cause you wanna be down?! (Okay)
(Wow, that's how you feel?)",
Drake,Scorpion,Blue Tint ,"[Intro: Future]
Mario
Pluto
Gang, gang, gang, gang, gang

[Chorus: Drake]
Look who I'm fuckin' again
I had her on ice but then
I watched the ice get thin
Now, does she sink or swim?

[Post-Chorus: Drake & Future]
She had an attitude in the summer
But she bein' nice again (She bein' nice)
Double my price again (Double my price)
Top of the charts, back in they hearts
Nigga, he strikes again, whoa
Some niggas bitter with life and they hate me
They wanna put knife in my ribs, whoa

[Verse 1: Drake]
Way this shit set up I live like Ronaldo
But I never been in Madrid, whoa
She said that that she workin', I told her come over
And we can get right at the crib, whoa
She finish at 6 but then say she got court in the morning to fight for her kid
I told her I'd pray for the kid

[Pre-Chorus: Drake & Future]
What a time this is (Whoa)
To be alive for this shit (Yeah)
President doin' us in (Woo)
My window got blue in the tint (Skrrt)
Did this shit once and I'd do it again

[Chorus: Drake]
Look who I'm fuckin' again
I had her on ice but then
I watched the ice get thin
Now, does she sink or swim?

[Refrain: Future & Drake]
(Blue faces)
Jeez
I got blue diamonds, blue tint, yeah
(Blue faces)
I got blue diamonds, blue tint, yeah
Jeez
Ayy, ayy

[Chorus: Drake]
Look who I'm stuck with again
I had her on ice but then
I watched the ice get so thin
Now, does she sink or does she swim, now?

[Post-Chorus: Drake & Future]
Ayy, 'cause she bein' nice again (She bein' nice)
Double my price again (Double my price)
Top of the charts, back in they hearts
Nigga, he strikes again, whoa
Some niggas bitter with life and they hate me
They wanna put knife in my ribs, whoa

[Verse 2: Drake]
Nobody better to show up and run it
And I could put that on the twins, whoa
We not together but I get the info on you
'Cause I'm nice to your friends
Whoa, whoa, whoa, whoa
Yeah, they shouldn't have told me but they did

[Pre-Chorus: Drake]
What a time this is (Whoa)
To be alive for this shit (Yeah)
President doin' us in (Woo)
My window got blue in the tint (Skrrt)
Ayy, did this shit once and I'd do it again

[Chorus: Drake]
Look who I'm fuckin' again
I had her on ice but then
I watched the ice get thin
Now, does she sink or swim?

[Refrain: Future]
(Blue faces)
I got blue diamonds, blue tint, yeah (Let's go)
(Blue faces)
I got blue diamonds, blue tint, yeah (Let's go)",
Drake,Scorpion,In My Feelings ,"[Intro: Drake]
Trap, TrapMoneyBenny
This shit got me in my feelings
Gotta be real with it, yeah

[Chorus: Drake]
Kiki, do you love me? Are you riding?
Say you'll never ever leave from beside me
'Cause I want ya, and I need ya
And I'm down for you always
KB, do you love me? Are you riding?
Say you'll never ever leave from beside me
'Cause I want ya, and I need ya
And I'm down for you always

[Verse: Drake]
Look, the new me is really still the real me
I swear you gotta feel me before they try and kill me
They gotta make some choices, they runnin' out of options
'Cause I've been goin' off and they don't know when it's stoppin'
And when you get to toppin', I see that you've been learnin'
And when you get to shoppin', you spend it like you earned it
And when you popped off on your ex he deserved it
I thought you were the one from the jump that confirmed it
TrapMoneyBenny
I buy you Champagne but you love some Henny
From the block like you Jenny
I know you special, girl, 'cause I know too many

[Chorus: Drake]
'Resha, do you love me? Are you riding?
Say you'll never ever leave from beside me
'Cause I want ya, and I need ya
And I'm down for you always
J.T., do you love me? Are you riding?
Say you'll never ever leave from beside me
'Cause I want ya, and I need ya
And I'm down for you always

[Interlude: J.T, Yung Miami, Drake & Magnolia Shorty]
Two bad bitches and we kissin' in the Wraith
Kissin'-kissin' in the Wraith, kiss-kissin' in the Wraith
I need that black card and the code to the safe
Code to the safe, code-code to the safe-safe
I show him how that neck work
Fuck that Netflix and chill—what's your net-net-net worth?
'Cause I want ya, and I need ya
And I'm down for you always
Yeah, yeah, yeah, yeah, he bad
And I'm down for you always
Yeah, yeah, yeah, guess who's back
And I'm down for you always
D-down for you al–
Black biggy biggy black biggy black blake
D-d-down for you always
I got a new boy, and that nigga trade!

[Chorus: Drake]
Kiki, do you love me? Are you riding?
Say you'll never ever leave from beside me
'Cause I want you, and I need you
And I'm down for you always
KB, do you love me? Are you riding?
Say you'll never ever leave from beside me
'Cause I want ya, and I–

[Breakdown: Lil Wayne & Magnolia Shorty]
Skate and Smoke and Rap
Now let me see you
Bring that ass, bring that ass, bring that ass back!
B-bring that ass, bring that ass, bring that ass back!
Shawty say the nigga that she with can't hit
But shawty, I'ma hit it, hit it like I can't miss
Now let me see you
Clap that ass, you're the only one I love
Clap that ass, clap-clap that ass!
Bring that ass back!
Clap-clap-clap that ass, you're the only one I love
Let's go, let's go, let's go!
Bring that ass back!

[Outro: Drake]
Trap, TrapMoneyBenny
This shit got me in my feelings
Gotta be real with it, yup
BlaqNmilD, you a genius, you diggin' me?

[Skit: Zazie Beetz]
I don't even care, I need a photo with Drake
Because my Instagram is weak as fuck
I'm just being real, my shit, look,–",
Drake,Scorpion,Don't Matter to Me by Drake & Michael Jackson ,"[Verse 1: Drake]
Ayy, wild things you're doin' at night
Trips to wherever feels right
Doin' it all just to feel things
Drinking's enough of a vice
Drugs just aren't suiting you right
You were just fine as a real thing, thing

[Refrain: Drake]
You, you, you know
That's not the way to get over me
I don't know what you're sayin'
You, you, you know
That's not the way to get over me

[Pre-Chorus: Michael Jackson]
All of a sudden you say you don't want me no more
All of a sudden you say that I closed the door

[Chorus: Michael Jackson]
It don't matter to me
It don't matter to me what you say
It don't matter to me
It don't matter to me what you say

[Verse 2: Drake]
I can't recover from our last conversation
You called me weak
And you tested my manhood as we yelled at each other
You wanted me to gon' put my hands on you
Just to show you I love you
You know I can't jeopardize both our reputations
Despite what you say
Despite what you choose to do with yourself this summer
You're actin' out, you know you love to see me down
Stressin' over somethin' (Stressin' over somethin')

[Refrain: Drake]
You, you, you, you, you know
That's not the way to get over me
I don't know what you're sayin'
You, you, you know
That's not the way to get over me

[Pre-Chorus: Michael Jackson]
All of a sudden you say you don't want me no more
All of a sudden you say that I closed the door

[Chorus: Michael Jackson]
It don't matter to me
It don't matter to me what you say
It don't matter to me
It don't matter to me what you say

[Outro: Michael Jackson]
Girl, your love, you think you broke it
I'm leavin' you today, you broke my heart
Girl, your love, you think you broke it
I'm leavin' you today, you broke my heart",
Drake,Scorpion,After Dark (Ft. Static Major & Ty Dolla $ign) ,"[Intro: Static Major]
Haha, haha
Yeah, ayy (After dark)

[Chorus: Drake, Static Major & Both]
In the whip solo
No one's gotta know (After dark)
Knockin' at your door
I don't gotta work anymore (After dark)
You can
Put your phone down, you're gonna need two hands (After dark)
You can't get enough
Girl, you know I set it up, for after dark

[Verse 1: Drake & Static Major]
Late night like Left Eye, I'm creepin'
Assuming the worst 'cause I haven't heard from you all weekend
Your silence is drivin' me up the wall, up the wall
I cannot tell if you're duckin' calls or missin' calls
'Cause you've been so patient
I drink on the job and smoke on the job
So, I don't know how serious you take it
Can't offer much more, you've heard it before
That narrative for me isn't changin'
I wanna make you a priority
I wanna let you know there's more to me
I wanna have your faith restored in me
I'll be on my way (After dark)

[Chorus: Drake, Static Major, Ty Dolla $ign, Drake & Static]
In the whip solo, no one's gotta know
(No one's gotta know) after dark
Knockin' at your door, I don’t gotta work anymore
(I don't gotta work no more) after dark
You can, put your phone down, you’re gonna need two hands
(Ooh yeah, ooh yeah) after dark
You can't get enough
Girl, you know I set it up, for after dark

[Verse 2: Ty Dolla $ign]
Late night, me and you, got you wet like the pool
Then I'm tryna dive in, put some time in, yeah
Get the vibe right, get your mind right
It's gon' be a long night (Ooh yeah)
Put your feet in this water, don't wanna get your hair wet
We've hooked up a couple times, we ain't took it there yet
You broke up with your man and ain't been with nobody else
You like, ""Fuck these niggas,"" rather keep it to yourself
He did you wrong, he left you down bad
Now you can't trust nobody
You said, ""Do anything, but just don't lie to me""
I said I ride for you, girl, you said you ride for me
Umm, pulled up to the show then we got ghost
And when it's after dark anything goes

[Chorus: Drake, Static Major, Ty Dolla $ign, Drake & Static]
In the whip solo, no one's gotta know
(No one's gotta know) after dark
Knockin' at your door, I don’t gotta work anymore
(I don't gotta work no more) after dark
You can, put your phone down, you’re gonna need two hands
(Ooh yeah, ooh yeah) after dark
You can't get enough
Girl, you know I set it up, for after dark

[Spoken Outro: Al Wood]
93.7, WBLK, [?] at the Quiet Storm, taking you right there with Hall & Oates. Moving you through the storm in what is now 19 minutes after 10 o’clock. Thanks for your phone calls as we get you closer to your requests and dedications. Phone lines are open for you to send a love, your love note dedications. 644-9393, call me. Coming up, we will head through your storm with Troop, Fantasia, Chaka Khan, my Funny Valentine Jill Scott, giving you whatever and more, the selected music of Mr. Luther Vandross, as we kick off your first hour of the most selective, most seductive, most relaxing four hours of the 93-7. It’s Al Wood and you are safe, soft and warm, in the loving embrace of my storm on BLK",
Drake,Scorpion,Final Fantasy ,"[Verse 1]
Yeah, I never really
Talk about dick that I wanna give you or places I wanna get to
Neck grab, hair grab
Arch back, heart attack, cardiac
I need it nasty like, like Evil Angel, like Vivid
You know, nasty like how they give it
You know, I need you to be open like Kai's kitchen
That pussy kinda sound like waves hittin' (Kshh!)
Soothin', keep it right there, no movin'
Make my way around the bases-es
I wanna take you to oasises
Bein' honest, I don't really know what patience is
Ayy, freaky like the red leather Michael
Zombie revival, this ain't like you
This that new you, this ain't high school (Hi)
I like best when you're fresh faced and no foundation
Willin' and ready for the takin'
Earth-shatterin', groundbreakin'
Headscarf for after our relations
No judgment is our arrangement
Make that face up if you dare
But just be prepared that I am gonna cause that lipstick to smear
And the mascara tears to run down
I always need a glass of wine by sundown
I always get your ass over here somehow
I hope that the apocalypse is the only thing that doesn't come now, we’re one now

[Interlude]
Did somebody…
Who'd they say that baby look like?
Drake!

[Verse 2]
Cashed out, my neck is frozen
Careful when we're mixin' potion
Slashin' like Guns N' Roses
You got options, but I been chosen
To deal with you the way you like
The way you like it (Woo woo, woo woo)
To deal with you the way you like
The way you like it (Woo woo, woo woo)
Cashed out, my neck is frozen
Careful when we're mixin' potion
Slashin' like Guns N' Roses
You got options, but I been chosen
To deal with you the way you like
The way you like it, yeah",
