Artist,Album,Song Name,Lyrics,
Bad Bunny,Single,No Me Conoce (Remix),,"[Letra de ""No Me Conoce (Remix)""]

[Intro: Bad Bunny & Jhay Cortez]
(Se hace la que no me conoce
Pero en mi cama se volvió un vicio como la 5-12)
(Yeh-yeh-yeh-yeh; ¿me sigue'?)
Nunca se deja ver (Nunca se deja ver; ¡no!)
Lo sabe disimular (Lo sabe disimular)
Tiene lo suyo y le va bien
Pero de noche conmigo le gusta portarse mal (Wuh-huh!)
Llega y lo que quiere es pecar, eh (Ey)
Está puesta pa’ bellaquear, eh (La presión)
Yo no la paro, y a veces mira raro y (¡Rrra!)

[Coro: Jhay Cortez & Bad Bunny]
Se hace la que no me conoce (La que no me conoce; no, no, no)
Pero en mi cama se volvió un vicio como la 5-12 (Como la 5-12)
Me la como entera y nadie se entera
Un par de amiga' (Un par de amiga'; wuh-huh)
To’as solteras, siempre la velan pa' que ella siga (Siga)
Se hace la que no me conoce (La que no me conoce)
Pero en mi cama se volvió un vicio como la 5-12 (Como la 5-12)
Me la como entera y nadie se entera
Un par de amiga' (¿Me sigue'?)
To'as solteras, siempre la velan pa' que ella siga

[Verso 1: Bad Bunny]
Huh-huh, eh
Si las miradas mataran, la tuya me hizo el amor (Eh)
Se ve que tú estás a vapor
Ella mata con traje y cuando se viste sport (Wuh)
Tiene el booty XL, pero usa los pantie' small
Una' pa’l no aguntan presión y la tienen bloquea’, eh
Un par de psycho, stalkea' (Eh)
No brega en la calle, pero está baquea’ (No)
La baby está muy dura, pa' mí que está hackea' (Eh), eh
Chiquitita pero grandota, en la uni buenas nota', eh
Niña buena, se le nota (Eh, eh), pero le explota la nota y (Ey)

[Coro: Bad Bunny & Jhay Cortez]
Se hace la que no me conoce (La que no me conoce; no, no, no)
Pero en mi cama, se lo metí en cuatro y en to’íta' las pose' (En to'íta' las pose'), eh
Me la como entera, nadie se entera
Con par de amiga' (Con par de amiga'; wuh-huh)
To'as solteras, siempre la velan pa' que ella siga (Pa' que ella siga; eh, eh-eh, eh)
Se hace la que no me conoce (La que no me conoce; no, no, no)
Pero en mi cama se volvió un vicio como la 5-12 (Como la 5-12)
Me la como entera y nadie se entera, un par de amiga' (Duro)
To'as solteras, siempre la velan pa' que ella siga
(Pa' que ella siga; ¿me sigue'?)

[Verso 2: J Balvin]
Me llama pa' que yo la pruebe y (Yah)
Cuando yo la toco, eso llueve ahí (-ve ahí)
Ella se vistió y yo la desvestí (Que sí)
Nunca dice: ""No"", siempre dice: ""Sí"" (Wuh)
Cuando quiere bailar, el dembow la azota (¿Qué?)
Ella se pone loca
Ella lo que quiere es peinarse (Wuh), y arreglarse (Wuh)
Llega a la disco a soltarse (Ah)
Que si me conoce, dice: ""No"", pero sabe bien que sí
Ella lo mezcla con alcohol, como cuando yo le di
En toda' las poses, preguntan y dice: ""No sé""
De contacto tiene ""José"", y siempre después de las 11 o 12

[Verso 3: Jhay Cortez]
Tira pa' que yo la pruebe
Se pone olorosa y me gusta como huele (Como huele)
Instagram privado pa' que nadie la vele
Se puso bonita porque sabe que hoy se bebe
A portarse mal pa' sentirse bien (Bien)
No quería fumar pero le dio al pen (Sí)
Una Barbie, pero no busca un Ken (No)
Siempre le llego cuando dice: ""Ven""
Pa' portarse mal se viste bien (Bien)
Dice la verdad y a vece' miente también
Apaga las notificacione' en el cel
Ella tiene lo suyo, pero hoy quiere joder

[Pre-Coro: Jhay Cortez]
Y yo le di por el expre-so
Le llené el cuello de be-so'
Le hice tiempo como un pre-so
Si la ve', no le hable' de e-so, que

[Coro: Jhay Cortez & J Balvin]
Se hace la que no me conoce (La que no me conoce)
Pero en mi cama se volvió un vicio como la 5-12 (Como la 5-12)
Me la como entera y nadie se entera
Un par de amiga' (Un par de amiga')
To'as solteras, siempre la velan pa' que ella siga (Siga; ah, ah, ah)
Se hace la que no me conoce (La que no me conoce)
Pero en mi cama se volvió un vicio como la 5-12 (Como la 5-12)
Me la como entera, nadie se entera
Un par de amigas (Un par de amiga')
Todas solteras, siempre la velan pa' que ella siga
(Pa' que ella siga; ¿me sigue?)

[Outro: Jhay Cortez, Bad Bunny & J Balvin]
(J Balvin, man; eh)
Dímelo, Balvin
Bad Bunny
Latino gang
¿Me sigue'?
La presión
Jhayco, Jhay Cortez
Jhayco, Jhay Cortez, eh (Oasis team)
Bad Bunny (Eh)
Na', na', na', Bad Bunny y J Balvin
(Yeh-yeh-yeh-yeh
Bad Bunny, baby-bebé)
(Jhay Cortez)
Na', no va a ser ustedes (Bad Bunny, baby-bebé, eh-eh-eh)
¿Me sigue' o no me sigue' todavía?
Yo creo que sí
Si Mvsis vuelve a poner un ritmo así, lo vuelvo a partir, ¿qué fue? Jaja
Oasis, Oasis
La trinidad"
Bad Bunny,Single,UN DÍA (ONE DAY),"[Letra de ""UN DÍA (ONE DAY)""]

[Intro: Dua Lipa, J Balvin & Bad Bunny]
You know that sometimes I think about us now and then
But I never wanna fall again, ah
Yo no te quisiera olvidar (Eh-eh)
Pero contigo es todo o na' (Eh-eh)
Yeah-yeah

[Pre-Coro: Dua Lipa]
You're deep in the water, yeah, you're drownin' us
You question my love like it's not enough
But I hate that you know, you know, you know
You got me tied up
You regret it now, but it's your mistake
What makes you think that my mind will change?
And you hate that you know, you know, you know
You know you messed up

[Coro: Dua Lipa]
One day you'll love me again
One day you'll love me for sure
One day you'll wake up feelin' how I've been feelin'
Baby, you'll knock at my door
One day you'll love me again
Hug me again till the end
One day you'll beg me to try
One day you'll realize I'm more than your lover
I'm more than your lover, I'm your friend

[Verso 1: J Balvin]
Acércate un poquito na' má'
Que yo quiero que te quedes conmigo
Deja a tus amiga' allá atrás, que no' vamos en un viaje escondido'
No' vamo' pa' Turks and Caicos
Y ahí calmamo' las ganas (Las ganas)
Suéltate conmigo, mamá (Mamá)
Que ya no hay marcha atrás
Una noche sin ti
No es tan fácil, baby
Que yo soy pa' ti (Soy pa' ti)
Y tú eres pa' mí (Tú eres pa' mí)

[Puente: J Balvin]
Nunca me dejes de querer
Oh, na-na-na
Contigo por siempre, baby
No quiero dejarte esta vez

[Coro: Dua Lipa]
One day you'll love me again
One day you'll love me for sure
One day you'll wake up feelin' how I've been feelin'
Baby, you'll knock at my door
One day you'll love me again
Hug me again till the end
One day you'll beg me to try
One day you'll realize I'm more than your lover
I'm more than your lover, I'm your friend

[Verso 2: Bad Bunny]
Yeah, yeah, yeah
Yo sé que estoy en tu corazón, quizá en el fondo
Otra baby me escribe, nunca le respondo (No)
La vida da vuelta' y el mundo es redondo
Y yo voy a que te beso de nuevo en London
O si no en Marbella (¡Wuh!)
Encima de la arena viendo la' estrella' (Yeh)
Yo sé que ni la' ola' han borra'o mi huella (Yeh)
Pero tu pichaera e' lo que me atropella
Sol, playa y en la arena, vamo' allá (¡Wuh!)
Baby, no te quede' callá'
Yo sé que tú quiere' guayar conmigo
Otra vez me tienes en depresión
Fumando en la habitación, eh
Pero yo sé que

[Coro: Dua Lipa & Bad Bunny, Ambos]
One day you'll love me again (¡Wuh!)
One day you'll love me for sure
One day you'll wake up feelin' how I've been feelin'
Baby, you'll knock at my door
One day you'll love me again
Hug me again till the end
One day you'll beg me to try
One day you'll realize I'm more than your lover
I'm more than your lover, I'm your friend

[Outro: Dua Lipa, J Balvin & Bad Bunny]
Baby, eh (Ay-ay-ay-ay-aye)
One day you'll love me again
One day you'll realize I'm more than your lover
I'm more than your lover, I'm your friend
J Balvin, man
Bad Bunny, baby
Tainy
Latino Gang (Yeah)
La Familia",
Bad Bunny,Single,100 MILLONES,"[Letra de ""100 MILLONES""]

[Intro: Bad Bunny]
¡Huh!
Yeah-eh, yeah
Ey
Yeh, ey (Grr), eh (Ay, no), eh (Grr)

[Coro: Bad Bunny]
Cien millone' dando vuelta' en un Can-Am (Un Can-Am)
Y las corta' ya tú sabe' dónde van (Prr, prr)
Un saludo pa' lo' hater', ¿cómo están? (Wuh-huh)
Que me odien, eso e' parte de mi plan, yeah (Ey, ey)
Mala mía, cabrone', pero estoy crecío' (Crecío'), eh, eh, eh
Siempre con un piquete nuevo y el de ello' vencío' (Ey)

[Verso 1: Bad Bunny]
Ya no e' Simón el que dice, ahora soy yo el que digo
Tu coro quiere hacer coro conmigo (Ey)
Me la' clavo de tre' en tre' como si yo fuera lo' Migo' (Huh-huh)
Mere, mamón, tú y yo no somo' amigo' (No, no), ey
Aquí no hay que aparentar (Nah)
Ando con unas teni' que tú no puede' cachar (Ajá)
Concentra'o haciendo ticket me metí siete Adderall
Quién e' el número uno no hay ni que preguntar (Ey, ey, ey)
To' saben que soy yo, eh (Wuh)
De PR pa'l mundo, gracia' al que creyó (Gracia')
Sentiste la presión cuando el camión te arrolló (Grr)
Si llaman a su pai, lo vo'a coger yo (Yo, yo, yo)
Y si le' va mal, no e' culpa mía (No)
Eh-eh-eh-eh, cabrone', no e' culpa mía
Yo estoy en mi peak, yo estoy en la mía, eh (Mía, ah-ah-ah)
Yo estoy en la mía

[Coro: Bad Bunny]
Cien millone' dando vuelta' en un Can-Am (Can-Am)
Y las corta' ya tú sabe' dónde van (Saben ya)
Un saludo pa' lo'hater', ¿cómo están? (Hola)
Que me odien, eso e' parte de mi plan, yeah (Huh, huh, huh, whuh)
Mala mía, cabrone', pero estoy crecío' (Crecío'), ey, ey, ey
Siempre con un piquete nuevo y el de ello' vencío' (Ey, ey, ey)

[Interludio: Luar La L]
¿Qué? Sí, jeje, El L3TRA (L3TRA)
Mera, El Conejo me envió una jodienda ahí pa' que tirara (Ahí dale)
Ahora está en el estudio esperando
Prende la mierda esa, vámono' pa'l carajo (Prende, prende)
Los G4, cabrón (¿Qué?; ¿cómo?)

[Verso 2: Luar La L]
En PR lo' carrito' y en Miami son la' Lambo
Llegó el rookie que les brincó to' lo' rango (Jaja)
Y ahora to' quieren sacarla, yo ando con Bad Bu pichando (¿Qué pasó, cabrón?)
Dosciento' mil en prenda', hasta de día estoy brillando (Je)
En Can-Am por to'a la playa dando vuelta' (Woh)
Cuando me parqueé vi que tu doña capeó el flow de abrir la' puerta' (Habla claro)
Salimo' con esta y cambió la vuelta, ¿qué? (¿Qué pasó?)
Y si van a bookearme, son má' de treinta (Paguen, paguen)
En carrito o en Corvetta (Jeje)
Toíto' quieren rolearme y ninguno pide la reta (¿Quién?)
Tengo un Role' y ni miro el tiempo, ando ruleta (Deja eso)
To' esto' hater' me lo maman, son peseta (¿Ah, qué?)
Tienen do' cara', esta combi sí e' cara (Lo e')
Si fantasmea', dispara y les chillamo' en la cara
Son peseta' do' cara' (Je), to'a mi' babie' son cara'
Si la' mando disparan, rrr, y te chillamo' en la cara (¿Qué?)

[Coro: Luar La L]
Cien millone' dando vuelta' en un Can-Am (Ah-ah-am)
Y la' pieza' ya tú sabe' dónde van
Un saludo pa' lo' hater' que son fan
Que me odien, eso es parte de mi plan, yeah (Yeah-eh-eh-eh-eh)
Mala mía, cabrone', pero estoy crecío', yeah
Les pasé a doscienta' milla', se quedaron dormío', yeah

[Verso 3: Bad Bunny]
Mera, papi, ¿cuándo me va' a montar en el carrito?
Ey, me enamoro to' lo' mese' (To' lo' mese')
Ey, una baby quiere plata, otra quiere que la bese (Muah)
Cada cual tiene lo que merece
Chequéate lo' Billboard, llevo número uno doce mese' (Ey, ey, ey, ey)
Auch, auch, eso duele (Eh)
Pa' to' el que me critica (Ja), que me lo pele (Rrr)
Toma un billete 'e cien pa' que sepa' cómo huele, huele (Huelebicho)
Y ahora tengo hasta a lo' gringo' conspirando (Uh)
Porque saben que el bori lo' 'tá matando, ey
Suck my dick, motherfucker (Eh), eh
Los tengo mamando, eh
Ahora to' el mundo 'tá llamando (¿Qué?)
Ya mismo me retiro, no sé cuándo (No sé)
Lo' escupo como Triple H entrando (Nah)
Dando vuelta' en PR o en Orlando, eh-eh (¿Qué fue?)",
Bad Bunny,Single,Yonaguni,"[Letra de ""Yonaguni""]

[Intro]
Yeah-yeah-yeah-yeah
Yeah-yeah-yeah-yeah-yeah-yeah
Yeah-yeah-yeah-eh, yeah

[Pre-Coro]
Una noche más y copas de más
Tú no me dejas en paz, de mi mente no te vas

[Coro]
Aunque sé que no debo, ey
Pensar en ti, bebé, pero cuando bebo
Me viene tu nombre, tu cara, tu risa y tu pelo, ey
Dime dónde tú está', que yo por ti cojo un vuelo
Y a Yonaguni le llego, oh
Aunque sé que no debo, ey
Pensar en ti, bebé, pero cuando bebo
Me viene tu nombre, tu cara, tu risa y tu pelo, ey
Dime dónde tú está', que yo por ti cojo un vuelo
Y a Yonaguni le llego, ey

[Verso 1]
No me busque' en Instagram, mami, búscame en casa
Pa' que vea' lo que pasa, ey
Si tú me prueba', te casa', ey
Ese cabrón ni te abraza
Y yo loco por tocarte
Pero ni me atrevo a textearte
Tú con cualquier outfit la parte'
Mami, tú ere' aparte
Shorty, tiene' un culo bien grande, eh
De-Demasia'o grande
Y yo lo tengo estudia'o, ya mismo me gradúo
Y en la cara me lo tatúo
Vi que viste mi story y subiste una pa' mí
Yo que me iba a dormir, ey
En la disco habían mil
Y yo bailando contigo en mi mente

[Coro]
Aunque sé que no debo
Pensar en ti, bebé, pero cuando bebo
Me viene tu nombre, tu cara, tu risa y tu pelo, ey
Dime dónde tú está', que yo por ti cojo un vuelo
Y a Yonaguni le llego

[Verso 2]
Si me da' tu dirección, yo te mando mil carta'
Si me da' tu cuenta de banco, un millón de peso'
To'a la noche arrodillado a Dio' le rezo
Pa' que ante' que se acabe el año tú me de' un beso
Y empezar el 2023 bien cabrón
Contigo y un blunt
Tú te ve' asesina con ese mahón (¡Wuh!)
Me matas sin un pistolón
Y yo te compro un Banshee
Gucci, Givenchy
Un poodle, un frenchie
El pasto, lo' munchie'
Te canto un mariachi
Me convierto en Itachi, eh

[Puente]
Yeah-yeah-yeah-yeah
Bad Bunny, baby, bebé
Bad Bunny, baby, bebé

[Outro]
今日はセックスしたい
でもあなたとだけ
どこにいますか？
どこにいますか？
今日はセックスしたい
でもあなたとだけ
どこにいますか？
どこにいますか？Eh",
Bad Bunny,Single,Rojo (feat. Atlmd),"(It's Spice boi on the track)

He say he sorry but I do not give a fuck imma leave his ass on read
If you gotta problem me and my niggas gon meet you anywhere you said
We gon put a bullet in your head
We gonna put you to bed
All of my niggas wear red
All of ‘em poppin’ them meds
Pop ‘em all triple thread
Shoot ‘em all like I said
Look at my head you see dreads
Shoot at that spot and you bled
We always runnin' from feds
Fuck with us then you dead

Double stack foam cup
I shoot and you squeak like a pup
You think you're hard and you’re tough
Your hands are not even rough
My homies got all the puff
Pastillas and the green stuff
We gon sell it all over seas
Already spread it around Indy
I'm talking Carmel, Fishers, HSE
All of these bitches so easy to please
Injun so all A's never D's
Stacking up all of these rupees
Like a lion I gotta mane
All of your cash look the same (a dollar!)
Put in work and I train
Running hard every day
Pushing fast like a train
High mileage we go insane
We running hard and we push through the race
I just counted 4 thousand in front of your face
Too much cash yea we gotta use rakes
All of this cash that I put in a safe
I'm about to go thirty we rolling up tape
Like a matador, I got the red cape
Your shooters shoot three while my shooters shoot eight
You thought you were winning till I pulled a check mate

He say he sorry but I do not give a fuck imma leave his ass on read
If you gotta problem me and my niggas gon meet you anywhere you said
We gon put a bullet in your head
We gonna put you to bed
All of my niggas wear red
All of ‘em poppin' them meds
Pop ‘em all triple thread
Shoot ‘em all like I said
Look at my head you see dreads
Shoot at that spot and you bled
We always runnin' from feds
Fuck with us then you dead

Yuh aye
All of niggas wear red
Snatchin your ho take her straight to the bed
Getting this paper, I'm getting this bread
You diss on my name I’ll put holes in your head (aye)
I cannot fuck with you niggas
Drop off a brick with my hand on the trigger
Your team is some monkeys my gang is gorillas
My shooters is waiting with forties they killers
My shooters be balling for money and shit
All of you hating just cuz I am rich
I don’t waste no time I don't fuck w no bitch
Planting C-4’s better watch where you sit (yuh)
I got ten racks on me right now (right now)
Pull up with a stick make you pipe down (pipe down)
Pistol with a silence it dont make a sound (sshh)
Better be careful in my hometown (skkrt)

He say he sorry but I do not give a fuck imma leave his ass on read
If you gotta problem me and my niggas gon meet you anywhere you said
We gon put a bullet in your head
We gonna put you to bed
All of my niggas wear red
All of ‘em poppin' them meds
Pop ‘em all triple thread
Shoot ‘em all like I said
Look at my head you see dreads
Shoot at that spot and you bled
We always runnin' from feds
Fuck with us then you dead

Running from feds running out of my time
Trust only homies these niggas so slime
Been wanting that cash but hoes wanna snort lines
I'm for real ‘bout this shit so don’t you be lying
My crew original y'all just a parody
I can't expect you to come up with a melody
Free up my homies convicted of felonies
We don't know no mercy watch out all my enemies
So shut your ass up still talking that trash
You need a mint your breath smelling like ass
Don't talk to me I don't fuck with your ass
Be careful cuz we finessing your cash
Niggas that test me about to get socked
Salty cuz they mans was lost to my Glock
If you a real pull up to my block
Ain't a broke boy I'm gon carry them rocks
Feds in my crib they be trying to find dope
Your chain is a string while my chain is a rope
Your girl leaving you when she look at my clothes
She know this nigga been making that dough
All of my homies been chasing that money
Shut your ass up I don't think this is funny
I'm a fly nigga I'm stearin your honey
Louis Supreme just like I am bad bunny

He say he sorry but I do not give a fuck imma leave his ass on read
If you gotta problem me and my niggas gon meet you anywhere you said
We gon put a bullet in your head
We gonna put you to bed
All of my niggas wear red
All of ‘em poppin' them meds
Pop ‘em all triple thread
Shoot ‘em all like I said
Look at my head you see dreads
Shoot at that spot and you bled
We always runnin' from feds
Fuck with us then you dead",
Bad Bunny,Single,De Museo,"[Letra de ""De Museo""]

[Intro]
Pasa el tiempo y yo sigo aquí
Un hermano no se traiciona, la familia nunca abandona
Pasa el tiempo y yo sigo aquí
Un hermano no se traiciona, la familia nunca abandona
Y yo no he cambia'o
Por má' dinero, por má' mujere'
Aquí la envidia no vive, con nosotro' se muere
Y yo no he cambia'o
Por má' dinero, por má' mujere'
Aquí la envidia no vive, con nosotro' se muere

[Verso 1]
Yeah
El tiempo pasa, pasa y no se detiene
Ya me estoy poniendo viejo y ayer era un nene, ey
Los problema' van y viеnen, ey
Pero еsto e' lo que me entretiene
Y yo con mi Dios siempre estoy agradecido
Por to' lo que he logrado y he vivido
Por to' lo que he llorado, por to' lo que he reído
Por lo' hermano' que están y to' lo' que se han ido
Ey, que desde el cielo me vigilan
Momento' que el alma te mutilan
Aquí estamo' activo', bo, nunca lo olvide'
Y espero que si puede' nos cuide' porque
Eh, yo espero que si puede' nos cuide' porque, jeje
Eh-eh, yo espero que si puede' nos cuide' porque
¡Ey, ey, ey! (¡Wuh!)

[Coro]
La calle está que pela (¡Eh!)
Siempre andamo' en el joseo (¡Wuh!)
La máquina e' de museo (¡Brrum, brrum!)
La paseo porque (¡Brrum!)
La calle está que pela (¡Ey!)
Nos cuidamo' de lo' feo'
Bo, deja ya ese fronteo
Aquí no lo' veo (¡No, no!), ey

[Verso 2]
Tú dice' que le mete' cabrón (Nah)
Yo digo que ere' un mamón (Mamón), ey
Tú no sale' conmigo ni en mi peor día (No, no)
¡Gol! Y ni me pego pa' la portería (¡Wuh, wuh, wuh!)
¡Plo, plo, plo! Diablo, qué mala puntería (Jeje)
Tengo to' los sabore', una heladería (Ice, ice, ice, ice, ice)
Di mi nombre tres vece' y te pega' en la lotería
Moviéndome, ey, como Iverson se movía (¡Prr, prr, prr, prr!)
Del privado pa'l Porsche
Sugar Díaz, los ponché
Qué perreo, flow Don Che
Rob Van Dam, ya los planché, ey (¡Wuh!)
Y no (No), me hicieron ni mella (Jajaja)
Rolls-Royce (¡Huh!; Rolls-Royce), miro la' estrella' (Jeje)
Ey, lo tuyo es cooperar y hacer mucha querella (Chota)
Lo mío e' facturar (¡Juju!), ey, y abrir mucha' botella'
Jeje, jeje, jeje, je (Yeah), hay que andar con cautela
(Fuego, fire, fuego, fire, fuego, fire, fuego, fire)
Porque

[Coro]
La calle está que pela (¡Eh!)
Siempre andamo' en el joseo (¡Eh, eh!)
La máquina e' de museo (¡Brrum, brrum, brrum!)
La paseo porque
La calle está que pela
Nos cuidamo' de lo' feo'
Bo, deja ya ese fronteo (¡Eh!)
Aquí no lo' veo (¡Eh, eh!)

[Outro]
La calle está que pela, ah-ah, ah-ah
¡Huh! ¡Huh!
Ey, ey, ey, ey, ey
¡Bad Bunny, baby!",
Bad Bunny,Single,Volando (Remix),"[Letra de ""Volando (Remix)""]

[Intro: Bad Bunny]
Yeah-yeah, yeah-yeah
Yeah-eh, ey, ey
Disfruto el poder verte aunque no sea conmigo (Oh-oh-oh), no, ey
Tengo que conformarme con ser solo tu amigo
Siempre pensando en tu nombre, vivo distraído
Por fin me enamoré y resulta que e' prohibido
Má' alante vive gente, pero no me he movido
Sigo estanca'o, siempre soñando contigo
El DM explota'o, pero las dejo еn leído
Mis letra' siemprе tienen tu nombre y apellido
Viviendo con mil pregunta', el lápi' sin punta
De todo lo que escribo, ma', tú tiene' la culpa
Llevo un año pagando la misma multa
Tú ere' ese mal que no sé por qué me gusta
El no poder olvidarte me frustra
Te lo juro que me frustra

[Coro: Sech & Mora]
Pero si me llamas le llego volando
En la Mercedes voy capsuleando
Y cuando no está', te sigo imaginando
Y sin ropa en mi cama, mi nombre gritando
Y si me llama' le llego volando
En la Mercede' voy capsuleando
Y cuando no está', te sigo imaginando
Sin ropa en mi cama, mi nombre gritando, oh

[Verso 1: Sech]
Voy volando aunque sufra de vértigo (Ey)
Y si me caigo no tengo un plan médico, oh-oh (Oh-oh)
Con tus senote' yo me siento en México (Ey)
Contigo el doctor me medicó, así que vente
Olvida el pasado, que el futuro lo tiene' de frente
No solo Bad tiene un ""X 100PRE""
Pero yo le llego, solo dime (Pero dime)
Que no me vaya
Cuéntame si tiro la toalla
O si la tiramos en la playa
Baby, voy volando por si la señal me falla (Ah-ah-ah-ah)

[Coro: Mora]
Y si me llama' le llego volando
En la Mercede' voy capsuleando
Y cuando no está', te sigo imaginando
Sin ropa en mi cama, mi nombre gritando, oh

[Verso 2: Mora]
Y si me llama' yo le caigo en el AMG
Baby, pa' terminar lo que a mitad dejé
En la cama hicimo' una serie, pero no PG
Y aunque me alejé
Sigo viendo tu cara cuando a otra se lo pongo
Si todavía tengo tu wallpaper de fondo
Ando sin salvavida' nadando en lo hondo
Yo siento tus latido' aunque me quede sordo

[Puente: Mora & Bad Bunny]
Y dime tú cómo e' que se sana este dolor
Si ya lavé las sábana', pero siguen con tu olor
Y yo solo pido sentir de nuevo tu calor
Ya probé una' cuanta', pero extraño tu sabor (Yeah-yeah-yeah-yeah,  ey)

[Verso 3: Bad Bunny]
Si tú me llama', yo le llego má' rápido que Emergencia'
Pa' ti no hay competencia
Cuando tú llega' se siente la diferencia
¿Será una maldición o coincidencia?
Con ese culote y esa carita
Tú ere' la mami favorita
Si estuviésemo' en kínder te enviaba cartita'
Llevo to' el día en la playa pa' ver si se me quita
La' estrella' te ven y piden un deseo
Baby, tú tiene' algo que yo solo veo
Ya no quiero más premio', no quiero más trofeo'
Yo lo único que pido e' mañana verte de nuevo, ey
Aunque sea con él
El cielo en el infierno, nadie va a entender
Huyendo 'e lo que siento, me cansé de correr
En mis ojo' se nota, no lo puedo esconder

[Coro: Bad Bunny]
Que si tú me llama' le llego volando
A la hora que tú diga', no importa dónde y cuándo
Y cuando no está' te sigo imaginando
Tu alma con la mía, las do' junta' vibrando, ey",
