Artist,Album,Song Name,Lyrics,
Bad Bunny,Oasis,QUÉ PRETENDES,"[Letra de ""QUÉ PRETENDES""]

[Intro: J Balvin]
Uah, uh-uh
Uah
Yeah, yeah, yeah, yeah (Uh-uh)

[Pre-Coro: J Balvin]
Ahora quiere' volver (Ahora quieres volver, yeah)
Por qué razón, dime para qué (Para qué, para qué)
Ya no te presto atención (Ninguna)
Desde hace tiempo le puse punto final (Sí)

[Coro: J Balvin]
¿Qué pretendes tú llamándome a esta hora? (Yeah, hora)
Esa actitud la conozco ya (Yeah-yeah-yeah)
Sabes qué hacer muy bien para envolverme (Envolverme)
Pero esta vez es muy tarde ya (Uah, oh-oh-oh)

[Verso 1: Bad Bunny]
Estas no son horas de llamar (No)
Al meno' que me lo quiera' mamar
Que quiera' prender, que quiera' quemar (Uh-huh)
Hablando claro ya tú me cae' hasta mal (Ja)
Por ti me metí pastilla' y me fui de over flow Lamar (Woh)
Pero tú no ere' una Kardashian (No)
Contigo no me tiro, porque si no las Retro se me embachan
De Snapchat te borré, de Facebook te borré
De Instagram te borré, de mi vida te borré (¡Plo!)

[Pre-Coro: Bad Bunny]
Y ahora quiere' volver (¡Nah!)
Nah, tú lo que quiere' e' joder (¡Wuh!)
Pero no se va a poder (Fuck you)
Me va' a ver con otra y te va' a morder (Uh)
Y ahora quiere' volver
Nah, tú lo que quiere' e' joder
Pero no se va a poder
Me va' a ver con otra y te va' a morder (¡Nah!)

[Coro: Bad Bunny]
¿Qué pretendes tú llamándome a esta hora? (Ey)
Esa actitud la conozco ya
Sabes qué hacer muy bien para envolverme
Pero esta vez es muy tarde ya
Yeah-yeah-yeah-yeah-yeah-yeah

[Verso 2: J Balvin]
Intentas hacerlo todo para que yo vuelva
Las cosas no son iguales, ¿para qué insistir?
Evita molestias y tu tiempo no pierdas
Conmigo no encuentras nada
A escondidas vives chequeando las fotos
Investigando mi perfil
No lo niegues, bien te conozco

[Puente: J Balvin]
Todo lo que tú hiciste conmigo
Quiere' repetirlo
Anda buscando más
Y a mí eso me da igual
Todo lo que tú hiciste conmigo
Quiere' repetirlo
Anda buscando más
Y a mí eso me da igual

[Coro: J Balvin & Bad Bunny]
¿Qué pretendes tú llamándome a esta hora? (Yeah, hora)
Esa actitud la conozco ya (Yeah-yeah-yeah)
Sabes qué hacer muy bien para envolverme (Envolverme)
Pero esta vez es muy tarde ya (Uah, oh-oh-oh)
¿Qué pretendes tú llamándome a esta hora? (Ey)
Esa actitud la conozco ya
Sabes qué hacer muy bien para envolverme
Pero esta vez es muy tarde ya
Yeah-yeah-yeah-yeah-yeah-yeah

[Outro: J Balvin, Bad Bunny]
Sky Rompiendo
Yeah, yeah, yeah, yeah
Rompiendo el Bajo
Bad Bunny, baby-be-be-bebé-bebé, bebé
J Balvin
Leggo'
J Balvin
Bad Bunny
Oasis
Oasis, baby
Esta va pa' ti",
Bad Bunny,Oasis,LA CANCIÓN,"[Letra de ""LA CANCIÓN""]

[Intro: Bad Bunny]
Yeh, yeh, yeh

[Estribillo: Bad Bunny]
Pensaba que te había olvida'o, eh
Pero pusieron la canción, eh, eh, eh
Que cantamo’ bien borracho'
Que bailamo' bien borracho’
Nos besamo' bien borracho' los dos
Pensaba que te había olvida'o, eh
Pero pusieron la canción, eh, eh, eh
Que cantamo' bien borracho'
Que bailamo' bien borracho'
Nos besamo’ bien borracho’ los dos
Pensaba que te había olvida'o

[Verso 1: J Balvin]
Justo cuando creía
Que por comerme a do’ o diez, te olvidaría' (Yeh)
Cogí un respiro y me salí de la vía
Y como un pendejo, no sabía lo que hacía
Nunca lo superé, nunca te superé (No; no)
Hasta me aprendí to'a la' balada’ en inglé' (Yeh)
Respiré y conté hasta tres (Uno, dos, tres)
Ere' la fantasía oscura de Kanye West, bebé, ey
Hace tiempo lo barato me salió caro (Yih)
Yo sólo twitteo, bala' loca' disparo (Yih)
¿Cómo olvidar la bellaquera en el carro?
¿A que guió solo?

[Estribillo: J Balvin & Bad Bunny]
Pensaba que te había' olvida'o (Pero no), yeh
Pero pusieron la canción, yeh, yeh
Que cantamos bien borrachos
Que bailamo' bien borrachos
Nos besamo' bien borracho' lo' dos
Pensaba que te había' olvida'o, eh
Pero pusieron la canción, yeh, yeh
Que cantamo' bien borracho'
Que bailamo' bien borracho'
Nos besamo' bien borracho' los dos, ey, ey

[Verso 2: Bad Bunny]
Y hace tiempo que no venía' a mi cabeza
Pero ya van par de cerveza'
Y me acordé de cómo tú me besa'
De to' lo' polvo' encima 'e la mesa
Y en el carro, la playa, y el motel
En casa de tu pai', cuando yo te iba a ver
Las vece' que tu mai' no' llegó a coger
Tú brincando mojaíta', sudando Chanel
Yo sé que lo nuestro e' cosa de ayer
Y me pone contento que te va bien con él
Yo ni te extrañaba ni te quería ver
Pero pusieron la canción que te gustaba poner
Y me acordé de ti, cuando me hiciste feliz
Se acabó, pues, me fui, ey
Yo mismo me río de mí porque—

[Estribillo: J Balvin]
Pensaba que te había' olvida'o, eh
Pero pusieron la canción, yeh, yeh
Que cantamos bien borrachos
Que bailamo' bien borrachos
Nos besamo' bien borracho' lo' do'

[Interludio Instrumental]

[Outro: Bad Bunny & J Balvin]
Y yo pensaba que tu nombre estaba muerto, eh
Pero te soñé despierto, ey
Hoy salí pa' la calle suelto
Sin sentimiento', el corazón desierto
Y yo pensaba que tu nombre estaba muerto
Pero te soñé despierto
Hoy salí pa' la calle sueltoSin sentimiento', el corazón desierto",
Bad Bunny,Oasis,UN PESO,"[Letra de ""UN PESO"" ft. Marciano Cantero]

[Coro: Bad Bunny]
¿Pa' qué me vas a amar si ya te dije adiós?
Si ya me despedí de ti, no quiero saber más de tus besos
¿Pa' qué me vas a amar? Ya te di tu perdón
El rencor nunca ha estado en mí
Ahora lo que hagas me vale un peso
¿Pa' que me vas a amar?

[Verso 1: J Balvin]
¿Pa' qué? si estamos en otras etapa' y ya te olvidé?
Si por ti me jodí, caí y me levanté
Con el que te venías, ya se fue
Me han llega'o par de razones que ya has roto corazones
Tratando 'e llenar vacíos que ni llenas con galones
Sí, esta es pa' que borracha la entone'
De ti solo extraño hacerlo sin condone'
Y con razón, tan poquito te dolió
De cora' que no fui yo el que la nave despegó
Y tu corazón idiota siempre me extrañará, baby

[Coro: Bad Bunny]
¿Pa' qué me vas a amar si ya te dije adiós?
Si ya me despedí de ti, no quiero saber más de tus besos
¿Pa' qué me vas a amar? Ya te di tu perdón
El rencor nunca ha estado en mí
Ahora lo que hagas me vale un peso

[Verso 2: Bad Bunny]
Yo te amaba, yo te quería
Pero ya se acabaron esos días
Ahora lloras, arrepentida
Pensando en mí, mientra' el café se te enfría
Estoy seguro que extrañas mi lunar
Y no tener a nadie pa' desayunar
Lo siento, mi amor, solo me di mi lugar
Busca otro corazón con el que jugar
A ti fui religioso, yo te adoré
La luna sabe lo que por ti lloré
Cuando estaba triste y tú nunca viniste
Pero normal, normal
Tranquila, que de ti yo no voy a hablar mal
Te puedo perdonar, pero nunca olvidar
No me hables bonito, vuelvo y repito

[Coro: J Balvin, Bad Bunny & J Balvin]
Pa' qué me vas a amar si ya te dije adiós?
Si ya me despedí de ti, no quiero saber más de tus besos
¿Pa' qué me vas a amar? Ya te di tu perdón
El rencor nunca ha estado en mí
Ahora lo que hagas me vale un peso

[Verso 3: Marciano Cantero]
No te podrás hacer la cirugía estética del alma
Para cambiar algo que no te falla
Tu piedra angular, tu piedra angular
¡Qué me vas a amar!
Yo existía si me imaginabas
Y daba un brinco si decías ""rana""
Pero me cansó ser tu pendejo

[Puente: Marciano Cantero]
¿Por qué perdiste sensibilidad?
Te fuiste sola sin mirar atrás
Aprendiste a diferenciar, lo que parece y lo que es
Lo que está escrito en las estrellas
A lo que está escrito en un papel
Otros amores también hay, como la novia de Forrest Gump
Dice el reloj en la pared, si nuestro amor terminó ayer
¿Qué me vas a amar, qué me vas a amar?

[Coro: Marciano Cantero & Bad Bunny]
¿Pa' qué me vas a amar si ya te dije adiós?
Si ya me despedí de ti, no quiero saber más de tus besos
¿Pa' qué me vas a amar? Ya te di tu perdón
El rencor nunca ha estado en mí
Ahora lo que hagas me vale un peso",
Bad Bunny,Oasis,ODIO,"[Letra de ""ODIO""]

[Intro: Bad Bunny]
No quiero saber de ti (No)
No sé qué haces aquí
Ya yo te lo advertí (Yeh, yeh)
Así que, mami, no te me ilusiones
Que pa' ti ya yo no escribo canciones
Lo que digan, me tiene sin cojones
Mala mía, bebé, no te encojones

[Coro: Bad Bunny]
Pero, en realidad, a ti ya yo te odio, odio (Huh)
Pasé de amor al odio (Odio)
Que me perdone Dios, pero te odio (¡Eh!)
¿Que no quiero na' contigo? Eso e' obvio (No, no, no, no, no)
Si quieres, te lo meto, pero será con odio, odio
Pasé de amor al odio (Odio)
Que me perdone Dios, pero te odio (¡Eh!)
¿Que no quiero na' contigo? Eso e' obvio
Si quieres, te lo meto, pero será con odio
(Yeh, yeh, yeh, yeh, yeh, yeh)

[Verso 1: J Balvin]
Tengo par de vídeos sexuales contigo por ahí (Sí)
Tú no te merece' a nadie el día 'e San Valentín (No, no)
Pa'l carajo con tu novio, quiero que no sea' feliz
Y en la calle se comente lo duro que yo te di (Wuh, wuh, wuh)
La calle y el trabajo (Huh), y los hoteles caros (Okay)
Si yo sabía cuánto ganabas, se me hizo raro (All right, all right)
En un yate en Miami, al otro día en Dubai (Wuh)
No me creas tan pendejo, ya eso e' lo que hay (Hay)
Rencor y remordimiento, sí
Lo tuyo y lo mío se fue con el viento, ey
Ando por ahí con otra, en tu asiento (Sí)
Ayer fuimos a comer y me gasté 500 (Ching!)
Y es por el maldito odio que ahora te tengo (Yeh)
Sí, voy a hacerte un velorio y de ti me vengo
Tranquila, de noche, tú vas a volver (Ajá)
Pidiendo que te lo haga solamente por placer y lo voy a hacer
Pero para que entiendas (Okay?)
Que si tienes tienda es pa' que la atiendas
Te confiaste y te creíste la jodienda (La jodienda)
Pa' ti ya no tengo espacio en mi agenda, baby
No te sorprendas (Wuh, wuh)
Creí que esto valía más que to'a mis prendas
Te confiaste y te creíste la jodienda
Y ahora quisiera perdonarte

[Coro: J Balvin]
Pero, en realidad, a ti ya yo te odio, odio (¿Cómo?)
Pasé de amor al odio
Que me perdone Dios, pero te odio
¿Que no quiero na' contigo? Eso es obvio
Si quieres, te lo meto, pero será con odio, odio
Pasé de amor al odio
Que me perdone Dios, pero te odio
¿Que no quiero na' contigo? Eso es obvio
Si quieres, te lo meto (Pero será con odio)

[Verso 2: Bad Bunny]
Te deseo lo peor (Eh), que tengas mala suerte
Que sufras en la vida y hasta después de la muerte (Eh)
Borré tus foto', ya no quiero verte (¡No!)
Lo mejor que me ha pasado fue perderte (Wu-huh)
Y no, no, no me busques má', no me busques má', que no estoy pa' ti
No, no, no me busques má', no me busques má'
Y si te trato mal (Eh), no e' intencional (No)
Es que por más que tú quieras, no te puedo amar (Na')
Si te trato mal (Eh), no e' intencional
Es que por má' que tú quiera' arreglar

[Coro: Bad Bunny]
Ya yo te odio, odio (Eh)
Pasé de amor al odio (Odio)
Que me perdone Dios, pero te odio (Wuh)
¿Que no quiero na' contigo? Eso e' obvio (Yeh, yeh, yeh, yeh, yeh, yeh)
Si quieres, te lo meto, pero será con odio, odio
Pasé de amor al odio
Que me perdone Dios, pero te odio
¿Que no quiero na' contigo? Eso e' obvio
Si quieres, te lo meto, pero será con odio, oh (Na')

[Outro: J Balvin & Bad Bunny]
(Pasé de amor al odio
Que me perdone Dios, pero te odio)
(¿Que no quiero na' contigo? Eso es obvio
Si quieres, te lo meto, pero será con odio, oh)
(Y es por el maldito odio que ahora te tengo)",
Bad Bunny,Oasis,COMO UN BEBÉ,"[Letra de ""COMO UN BEBÉ"" ft. Mr Eazi]

[Intro: J Balvin]
Legendury Beatz
Yeah, Oasis
Leggo
Leggo

[Puente: J Balvin]
Trato, trato y queda nada
Peleamos otra vez (Otra vez, otra vez, otra vez, otra vez)
Trato, trato, a veces me habla
Y a veces no también (¿Por qué?), como un bebé
Mami, ya, mami, ya (Ya), me cansé de pelear (No)
Baby, ya, baby, ya (Ya), no esperes que yo responda
Y sólo dame un break, break, break
Creo que tú jodes como la ley (Uh)
No diga' de nuevo ""okay"", trátame bien, babe

[Coro: J Balvin, Mr Eazi & Bad Bunny]
Así que baila pa' mí, baila pa' mí
Me gusta la manera cuando me lo mueve' así
Así que baila pa' mí, baila pa' mí
Me gusta la manera cuando me lo mueve' así, yeah
Baila pa' mí, baila pa' mí
Me gusta la manera en que tú lo mueve' así
Baila pa' mí, baila pa' mí
Trátame bien, babe (Yeah)

[Puente: Bad Bunny]
Ey, ey, ey
Trato, trato y queda nada
Peleamos otra vez, ey, ey, ey (Ey)
Trato, trato, a veces me habla
Y a veces no también (¿Por qué?), como un bebé
Mami, ya, mami, ya me cansé de pelear
Baby, ya, baby, ya no esperes que yo responda
Y sólo dame un break, break, break (¡Break!)
Creo que tú jodes como la ley (¡Huh!)
No diga' de nuevo ""okay"", trátame bien

[Verso 1: Bad Bunny]
Yo no 'toy pa' pleito' (Pleito'), baila, que yo me deleito (-leito)
Al ritmo de mi canción (Huh), claro que tiene' razón
Yo no vo'a discutir, mejor te empieza' a desvestir, ey
Pa' que te vo'a mentir, ey? Chica, ya

[Coro: Bad Bunny, Mr Eazi & J Balvin]
Y dale, baila pa' mí, baila pa' mí
Me gusta la manera cuando me lo mueve' así
Así que baila pa' mi, baila pa' mí
Me gusta la manera cuando me lo mueve' así, yeah
Baila pa' mí, baila pa' mí
Me gusta la manera en que tú lo mueve' así (Eh)
Baila pa' mí, baila pa' mí
Eh, eh, eh, eh

[Verso 2: Mr Eazi]
Oya se jeje ma lo te
Nkan to ba fe ni mo fe
Oya se jeje ma lo te
Nkan to ba fe ni mo fe
Tell me what you want
Tell me what you want
You know I go give you, yeah yeah
If na lovin' you want
If na lovin' you need
You know I go give you jeje
Damilola, damilola
Girl your body long, no be banner
Mami, ya, mami, ya
Mami, dame un break, break, break

[Coro: Bad Bunny, Mr Eazi y J Balvin]
Y dale, baila pa' mí, baila pa' mí
Me gusta la manera cuando me lo mueve' así
Así que baila pa' mi, baila pa' mí, eh
Me gusta la manera cuando me lo mueve' así, yeah
Baila pa' mí, baila pa' mí
Me gusta la manera en que tú lo mueve' así
Baila pa' mí, baila pa' mí
Eh, eh, eh

[Outro: J Balvin, Mr Eazi & Bad Bunny]
Mr. Eazi, we make it easy
(Baila pa' mí)
Latino Gang, Oasis
Bad Bunny, baby
(Baila pa' mí)
J Balvin, baby
(Baila pa' mí)
Mr. Eazi, baby
(Baila pa' mí)
Everything, baby
(Baila pa' mí)
Yeah, yeah
Yeah, yeah",
Bad Bunny,YHLQMDLG,Si Veo a Tu Mamá,"[Letra de ""Si Veo a Tu Mamá""]

[Intro]
Yeh, yeh

[Coro]
Todavía yo te quiero
Pero sé que e' un error
Porque ya tú no me quieres
Y sin ti me va mejor
Y si veo a tu mamá (Ey)
Yo le pregunto por ti
Pa' ver si ya tienes a alguien (¿Uh?)
Alguien que te haga feliz

[Verso 1]
Y aquí estoy arrebata'o
Pensando en to'a las vece' que te lo metí
Pensando en to'a las vece' que estuve pa' ti (Pa' ti, pa' ti, pa' ti)
No sé por qué diablo' me engaño (No)
Diciendo que te olvidé cuando te extraño
Solo comparto memes, ya yo no escribo nada (Damn)
Y no he borra'o tu foto, solo la puse privada

[Verso 2]
Maldito año nuevo y lo que me trajo, ey
Me botaron del trabajo por estar mirando pa' abajo
Pensando en ti siempre cabizbajo
Me veo gordito, nada que rebajo (Nah)
No sé por qué la vida me ultrajo (No)
Pensando coger un atajo
Conocí a alguien, pero no sé, nunca encajo (Ah)
Al meno' que sea' tú (Tú, tú, tú, tú)
Baby, te quiero aunque diga lo contrario
Llevo sei' mese' solitario, pero

[Puente]
Hoy salí con lo' muchacho' a beber (Jaja)
Y dije que de ti no iba hablar (No, no, no)
Son las 5, ya va amanecer (Ku-ku-ku-ku)
Si no prenden, la voy a llamar
Hoy salí con lo' muchacho' a beber (Jaja)
Y dije que de ti no iba hablar (No, no, no)
Son las 5, ya va amanecer (Ku-ku-ku-ku)
Si no prenden, la voy a llamar

[Coro]
Todavía yo te quiero (Yo te quiero)
Pero sé que e' un error (Se hace, no)
Porque ya tú no me quieres (No, no)
Y sin ti me va mejor (Juju)
Y si veo a tu mamá (Mami), ey
Yo le pregunto por ti (Okey)
Pa' ver si ya tienes a alguien
Alguien que te haga feliz
Jajaja",
Bad Bunny,YHLQMDLG,La Difícil,"[Letra de ""La Difícil""]

[Pre-Coro]
Ella desaparece, pero aparece cuando le dan gana'
Han sido un par de vece', y si e' por mí le doy to'a la semana
Se hace la que no quiere, pero llama de madrugada
Terminaste sin ropa otra ve', pidiendo que te tocara, eh-eh

[Coro]
Se hace la difícil, pero se va
Anda con la amiga siempre arrebatá'
Pidiendo que le llegue, eh (Eh)
Que a ella me entregue, eh (Eh, eh)
Pidiendo que le llegue, eh (Eh, eh)
Aunque a vece' me niegue, eh (Ey, ey, ey, ey; prra)

[Verso]
Prende, pasa, dime qué pasó (Eh)
Quería un gatito y lo cazó (Lo cazó)
De la' relacione' se cansó (Ja)
La última que tuvo la atrasó (Ja; wuh)
Tú la ve' en el VIP, modelo como Hadid
Invicta como Khabib
Má' de cien cabrone' que ella deja en read (Read)
A vece' la' rola' y la weed (Weed)
Una estrella porno, chinga como Riley Reid (Wuh)

[Puente]
Tiene a to' lo' nene' loco y a la nena' loca' (Loca')
To' quieren besarle la boca, ey
Mírala cómo se toca (Wuh; se toca, se toca, se toca)
Bailando e' que me provoca
Tiene a to' lo' nene' loco y a la nena' loca' (Loca')
To' quieren besarle la boca, ey
Mírala cómo se toca (Se toca, se toca, se toca, ey)
Perreando e' que me provoca (¡Wuh!)

[Coro]
Se hace la difícil, pero se va
Anda con la amiga siempre arrebatá', ah-ah
Pidiendo que le llegue, eh
Que a ella me entregue, eh
Pidiendo que le llegue, eh
Aunque a vece' me niegue, eh (Ey, ey, ey, ey)

[Post-Coro]
Prende, pasa, dime qué pasó
Pre-Prende, pasa, dime qué pasó
Pre-Prende, pasa, dime qué pasó
Dime, qué pasó, ey
Tiene a to' lo' nene' loco y a la nena' loca', loca', loca', loca'
Tiene a to' lo' nene' loco y a la nena' loca', loca', loca', loca'

[Outro]
Eh-eh-eh, eh-eh-eh
Súbelo NEO
La Paciencia, ey
Bad Bunny, baby, bebé, eh, eh, eh
Bad Bunny, baby, bebé, eh, eh, eh
Wuh",
Bad Bunny,YHLQMDLG,Pero Ya No,"[Letra de ""Pero Ya No""]

[Intro]
Yeh-yeh-yeh-yeh-yeh-yeh-yeh-yeh-eh
¡Ju! Okey, ey, ey

[Estribillo]
Ante' yo te quería, pero ya no
Tú me gustaba', pero ya no
Yo estaba pa' ti, pero ya no
Ey, pero ya no, ey, pero ya no
Ante' yo te quería, pero ya no
Tú me gustaba', pero ya no
Yo estaba pa' ti, pero ya no
Ey, pero ya no, ey, pero ya no (Ey, ey, ey, ey)

[Puente]
Conmigo ya no tiene' break, ey
Ya no quiero de tu amor fake, ey
Ya no estoy pa' ti, ya no estoy pa' ti
Conmigo ya no tiene' break, ey
Ya no quiero de tu amor fake, ey
Ya no estoy pa' ti, ya no estoy pa' ti

[Verso]
Ahora en toa' las rede' me sigue'
Sorry, mami, no me hostigue'
Pero como yo no se consigue
Tú fuera' mi J.Lo, yo tu Álex Rodrígue'
Pero, ahora me gusta otra sicaria que vive por Bayamón
A mí ya no me cachas, yo no soy un Pokémon
Tengo a otra que me brinca hasta que se joda el camón
No quiero que me llore', no venga' con el dramón, no
Que ya no estamo' pa' los tiempo' de la high, ey
Hace rato que te dije ""bye""
Gracias por el apoyo, baby, gracia' por los like'
Yo estoy con cinco cubana' y cuatro hookah en Mokai
Me compré una Hayabusa y no te vo' a dar una ride
En verda' prefiero dárselo a tu mai'
Contigo no me enfango, no vo' a manchar las Off-White
Si no te gusta, sorry, esa e' la que hay

[Estribillo]
Porque ante' yo te quería, pero ya no
Tú me gustaba', pero ya no
Yo estaba pa' ti, pero ya no
Ey, pero ya no, ey, pero ya no

[Outro]
¡Acho, bro!",
Bad Bunny,YHLQMDLG,La Santa,"[Letra de ""La Santa""]

[Intro: Bad Bunny & Daddy Yankee]
Tú no ere' una santa, ni yo soy un santo
Nos conocimo' pecando
Ahora me está' buscando
Porque quiere más de mí (¡Bad!)
Y yo te lo doy (¡Bunny!)
Te viene' y me voy (DY)
Te lo dije que esto era pa' jugar
Que no te podía' enamorar (¡Sube, sube, plo!)

[Coro: Bad Bunny & Daddy Yankee]
Que ahora me quiere' cambiar
Sabiendo cómo soy, tú sabe' lo que doy
No te haga', tú ere' igual (¿Qué, qué, qué?)
No te haga' la santa, el perreo te encanta (You know)
Y ahora me quiere' cambiar (Yeah-yeah, eh)
Sabiendo cómo soy, tú sabe' lo que doy
No te haga', tú ere' igual (Tú ere' igual, bebé)
No te haga' la santa, el perreo te encanta (¡Da-ddy!)

[Verso 1: Daddy Yankee]
Mami, somo' polo positivo y negativo (¿Qué?)
A la flecha de Cupido siempre me le esquivo (Cucú)
Tenemo' secreto' guarda'o en el archivo
No va a haber confianza si contigo convivo, baby
'Tás calentándote (Wow), yo calentándome (Eh)
Y tú dice' que tú ere' brava, pero a vece' te me quita (Rrr)
Y vuelve' y me excita'
Pero yo no soy el hombre que necesita' (Yeh)

[Pre-Coro: Bad Bunny & Daddy Yankee]
Yo no voy con labia, no
Tú sabía' la que había, baby
El romance no e' mi área, no (¿Qué?)
No me diga' que te enamoraste de mí
Yo no voy con labia, no
Tú sabía' (Tú sabía'), la que había, baby (Baby)
El romance no e' mi área, no
No me diga' (No me diga'), que te enamoraste de mí (Mí)

[Coro: Bad Bunny & Daddy Yankee]
Y ahora me quiere' cambiar (Sube)
Sabiendo cómo soy, tú sabe' lo que doy
No te haga', tú ere' igual (Tú ere' igual, bebé)
No te haga' la santa, el perreo te encanta
Y ahora me quiere' cambiar (Me quiere' cambiar)
Sabiendo cómo soy, tú sabe' lo que doy
No te haga', tú ere' igual (Trr)
No te haga' la santa, el perreo te encanta (Bad Bunny, come on)

[Verso 2: Bad Bunny & Daddy Yankee]
No me diga' que me quiere', no me diga' que me ama'
Tú sabe' que no te creo
Mucho meno' en tu cama
Seguimo' envuelto' en la bellaquera, ey
Ey, la noche entera
Eso de enamorarse no e' pa' cualquiera
Dejé el corazón dentro 'e la nevera
Lo tengo frío, frío, sorry, pero en nadie confío
Tú sigue en lo tuyo y yo en lo mío
Buena' noche', fue un placer, ey
Pero no me va' a convencer (Come, on)

[Pre-Coro: Bad Bunny & Daddy Yankee]
Yo no voy con labia, no
Tú sabía' la que había, baby
El romance no e' mi área, no
No me diga' que te enamoraste de mí
Yo no voy con labia, no
Tú sabía' (Tú sabía'), la que había, baby (Eh-eh)
El romance no e' mi área, no
No me diga' (No me diga'), que te enamoraste de mí (¿Qué?)

[Coro: Daddy Yankee & Bad Bunny]
Y ahora me quieres cambiar
Sabiendo cómo soy, tú sabe' lo que doy
No te haga', tú ere' igual (Tú ere' igual, bebé)
No te haga' la santa, el perreo te encanta
Y ahora me quiere' cambiar
Sabiendo cómo soy, tú sabe' lo que doy (Yo')
No te haga', tú ere' igual
No te haga' la santa, el perreo te encanta, eh

[Outro: Daddy Yankee]
Mucho party, mucho money
Daddy Yankee, Bad Bunny
Mucho party, mucho money
Daddy Yankee, Bad Bunny",
Bad Bunny,YHLQMDLG,Yo Perreo Sola,"[Letra de ""Yo Perreo Sola"" ft. Nesi]

[Refrán: Nesi]
Ante' tú me pichaba' (Tú me pichaba')
Ahora yo picheo (Hmm, nah)
Antes tú no quería' (No quería')
Ahora yo no quiero (Hmm, no)
Ante' tú me pichaba' (-chaba')
Ahora yo picheo (Jaja)
Antes tú no quería' (Ey)
Ahora yo no quiero
No, tranqui

[Coro: Nesi & Bad Bunny]
Yo perreo sola (Hmm, ey)
Yo perreo sola (Perreo sola; jaja; hmm-hmm)
Yo perreo sola (Jaja, hmm; ey)
Yo perreo sola (Perreo sola)
Okay, okay, ey, ey, ey

[Verso 1: Bad Bunny]
Que ningún baboso se le pegue (No)
La disco se prende cuando ella llegue (¡Wuh!)
A los hombres los tiene de hobby
Una malcriá' como Nairobi (Jaja)
Y tú la ve' bebiendo de la botella (Ey)
Los nene' y las nena' quieren con ella
Tiene má' de veinte, me enseño la cédula (Ajá)
Ey, del amor e' una incrédula (¡Wuh!)
Ella está soltera antes que se pusiera de moda (Ey)
No cree en amor desde ""Amorfoda"" (No)
El DJ la pone y se las sabe todas
Se trepa en la mesa y que se jodan (Wuh)
En el perreo no se quita (¡No!)
Fuma y se pone bellaquita
Te llama si te necesita
Pero por ahora está solita

[Coro: Bad Bunny]
Ella perrea sola (Wuh)
Ey, ey, ey, ey, ey, ey
Ella perrea sola
(Perrea sola, ella perrea sola, sola, sola)
Ey, ella perrea sola
Ey, ey, ey, ey, ey, ey
Ella perrea sola (Ella perrea sola)
Ella perrea sola

[Verso 2: Bad Bunny]
Tiene una amiga problemática
Y otra que casi ni habla (No)
Pero las tre' son una' diabla' (Prr)
Y hoy se puso minifalda
Los phillie' en las Louis Vuitton los guarda

[Puente: Bad Bunny & Nesi]
Y me dice ""papi"" (Papi, sigue; yes, yes)
'Tá bien dura como Natti (Aah)
Borracha y loca, a ella no le importa (Woo)
Vamo' a perrear, la vida es corta, ey (Hoo)
Y me dice ""papi"" (Papi, sigue; yes, yes)
'Tá bien dura como Natti (Aah)
Despué' de las doce no se comporta (Ey)
Vamo' a perrear, la vida e' corta (Woo)

[Refrán: Nesi & Bad Bunny]
Ante' tú me pichaba' (Tú me pichaba')
Ahora yo picheo (Hmm, nah; loco)
Ante' tú no quería' (¿Pero cuándo yo dije eso?)
Ahora yo no quiero (Pero, pero; no)
Ante' tú me pichaba' (Nah)
Ahora yo picheo (Yo nunca te he picha'o, mami)
Ante' tú no quería' (Ay, Dio')
Ahora yo no quiero
No, tranqui

[Coro: Nesi]
Yo perreo sola (Hmm, ey)
Yo perreo sola (Perreo sola; jaja; hmm-hmm)
Yo perreo sola (Jaja, hmm; ey)
Yo perreo sola (Perreo sola)",
